{
  "$schema": "../../schemas/extension.schema.json",
  "schemaVersion": 1,
  "slug": "window-resizer",
  "packageName": "@osbe/window-resizer",
  "displayName": "OSBE Window Resizer",
  "surface": "popup",
  "summary": "Resize the current Chrome window from built-in device presets or your own saved sizes.",
  "singlePurpose": "Resize the current Chrome browser window to a user-selected saved width and height.",
  "permissions": [
    {
      "name": "storage",
      "justification": "Stores the user's custom window-size presets and preferred preset order locally on their device."
    }
  ],
  "hostPermissions": [],
  "dataUsage": [],
  "remoteCode": {
    "used": false,
    "justification": "The extension does not use remote code. All executable JavaScript and CSS is included in the submitted package."
  },
  "store": {
    "category": "Productivity",
    "language": "English",
    "visibility": "public",
    "pricing": "free",
    "screenshots": [
      {
        "file": "store-assets/screenshots/window-resizer-1280x800.png",
        "source": "store-assets/source/window-resizer-popup.png",
        "title": "Resize a Chrome window with one click from built-in presets.",
        "description": "The popup shows the current browser size, built-in presets, and controls for creating and managing custom sizes."
      }
    ],
    "promoTiles": []
  },
  "release": {
    "workflow": "submit-window-resizer.yml",
    "secretName": "WINDOW_RESIZER_SUBMIT_KEYS"
  },
  "smoke": {
    "page": "popup.html"
  }
}
